{
  "type": "object",
  "properties": {
    "schemaVersion": {
      "type": "string"
    },
    "method": {
      "type": "string",
      "const": "anki"
    },
    "name": {
      "type": "string",
      "minLength": 1
    },
    "tags": {
      "type": "array",
      "items": {
        "type": "string"
      },
      "default": []
    },
    "cards": {
      "type": "array",
      "items": {
        "type": "object",
        "properties": {
          "front": {
            "type": "string",
            "minLength": 1
          },
          "back": {
            "type": "string",
            "minLength": 1
          },
          "tags": {
            "type": "array",
            "items": {
              "type": "string"
            },
            "default": []
          },
          "stability": {
            "type": "number"
          },
          "difficulty": {
            "type": "number"
          },
          "due": {
            "type": "string"
          },
          "lastReview": {
            "type": [
              "string",
              "null"
            ]
          },
          "state": {
            "type": "string",
            "enum": [
              "new",
              "learning",
              "review",
              "relearning"
            ]
          },
          "reps": {
            "type": "integer",
            "minimum": 0
          },
          "lapses": {
            "type": "integer",
            "minimum": 0
          }
        },
        "required": [
          "front",
          "back"
        ],
        "additionalProperties": false
      }
    }
  },
  "required": [
    "schemaVersion",
    "method",
    "name",
    "cards"
  ],
  "additionalProperties": false,
  "$schema": "http://json-schema.org/draft-07/schema#"
}
