{
  "schemaVersion": "1.0.0",
  "method": "anki",
  "name": "Spanish A2 Vocabulary",
  "tags": ["language", "spanish"],
  "cards": [
    { "front": "casa", "back": "house", "tags": ["noun"] },
    { "front": "coche", "back": "car", "tags": ["noun"] },
    { "front": "perro", "back": "dog", "tags": ["noun"] },
    { "front": "gato", "back": "cat", "tags": ["noun"] },
    { "front": "agua", "back": "water", "tags": ["noun"] },
    { "front": "leche", "back": "milk", "tags": ["noun"] },
    { "front": "pan", "back": "bread", "tags": ["noun"] },
    { "front": "ciudad", "back": "city", "tags": ["noun"] },
    { "front": "calle", "back": "street", "tags": ["noun"] },
    { "front": "trabajo", "back": "job", "tags": ["noun"] },
    { "front": "dinero", "back": "money", "tags": ["noun"] },
    { "front": "amigo", "back": "friend", "tags": ["noun"] },
    { "front": "familia", "back": "family", "tags": ["noun"] },
    { "front": "madre", "back": "mother", "tags": ["noun"] },
    { "front": "padre", "back": "father", "tags": ["noun"] },
    { "front": "hermano", "back": "brother", "tags": ["noun"] },
    { "front": "libro", "back": "book", "tags": ["noun"] },
    { "front": "mesa", "back": "table", "tags": ["noun"] },
    { "front": "silla", "back": "chair", "tags": ["noun"] },
    { "front": "puerta", "back": "door", "tags": ["noun"] },
    { "front": "caminar", "back": "to walk", "tags": ["verb"] },
    { "front": "correr", "back": "to run", "tags": ["verb"] },
    { "front": "hablar", "back": "to speak", "tags": ["verb"] },
    { "front": "escuchar", "back": "to listen", "tags": ["verb"] },
    { "front": "comer", "back": "to eat", "tags": ["verb"] },
    { "front": "beber", "back": "to drink", "tags": ["verb"] },
    { "front": "dormir", "back": "to sleep", "tags": ["verb"] },
    { "front": "trabajar", "back": "to work", "tags": ["verb"] },
    { "front": "estudiar", "back": "to study", "tags": ["verb"] },
    { "front": "leer", "back": "to read", "tags": ["verb"] },
    { "front": "escribir", "back": "to write", "tags": ["verb"] },
    { "front": "vivir", "back": "to live", "tags": ["verb"] },
    { "front": "llegar", "back": "to arrive", "tags": ["verb"] },
    { "front": "salir", "back": "to go out", "tags": ["verb"] },
    { "front": "volver", "back": "to return", "tags": ["verb"] },
    { "front": "empezar", "back": "to begin", "tags": ["verb"] },
    { "front": "terminar", "back": "to finish", "tags": ["verb"] },
    { "front": "querer", "back": "to want", "tags": ["verb"] },
    { "front": "poder", "back": "to be able to", "tags": ["verb"] },
    { "front": "tener", "back": "to have", "tags": ["verb"] },
    { "front": "grande", "back": "big", "tags": ["adjective"] },
    { "front": "pequeño", "back": "small", "tags": ["adjective"] },
    { "front": "rojo", "back": "red", "tags": ["adjective", "color"] },
    { "front": "azul", "back": "blue", "tags": ["adjective", "color"] },
    { "front": "nuevo", "back": "new", "tags": ["adjective"] },
    { "front": "viejo", "back": "old", "tags": ["adjective"] },
    { "front": "bueno", "back": "good", "tags": ["adjective"] },
    { "front": "malo", "back": "bad", "tags": ["adjective"] },
    { "front": "feliz", "back": "happy", "tags": ["adjective"] },
    { "front": "difícil", "back": "difficult", "tags": ["adjective"] },
    { "front": "triste", "back": "sad", "tags": ["adjective"] },
    { "front": "fácil", "back": "easy", "tags": ["adjective"] },
    { "front": "rápido", "back": "fast", "tags": ["adjective"] },
    { "front": "lento", "back": "slow", "tags": ["adjective"] },
    { "front": "abierto", "back": "open", "tags": ["adjective"] },
    { "front": "cerrado", "back": "closed", "tags": ["adjective"] },
    { "front": "comprar", "back": "to buy", "tags": ["verb"] },
    { "front": "vender", "back": "to sell", "tags": ["verb"] },
    { "front": "ayudar", "back": "to help", "tags": ["verb"] },
    { "front": "necesitar", "back": "to need", "tags": ["verb"] }
  ]
}
